<?xml version="1.0" encoding="UTF-8"?>
<r:SDPRules xmlns:r="http://www.sdp.com/SDPRules" 
            xmlns:xsi="http://www.w3.org/2001/XMLSchema-instance" 
            xsi:schemaLocation="http://www.sdp.com/SDPRules ../SDPRules.xsd ">

   <r:header>
      <title>Instrucciones no permitidas</title>
      <replace>true</replace>
   </r:header>
   
   <r:group name="STMT">
      <idGroup>40</idGroup>
      <prefix>STM</prefix>
      <r:description>
          <text lang="xx">Instrucciones no permitidas</text>      
      </r:description>
      
      <r:item name="STMT">
         <object>STATEMENT</object>
         
         <r:rule>
            <severity>5</severity>
            <condition>
               <type>string</type>
               <operator>equal</operator>
               <rvalue>GOTO</rvalue>
            </condition>            
         </r:rule>

         <r:rule>
            <severity>5</severity>
            <condition>
               <type>string</type>
               <operator>equal</operator>
               <rvalue>DISPLAY</rvalue>
            </condition>            
         </r:rule>
         
      </r:item>

   </r:group>

</r:SDPRules>
